{
  "$schema": "https://json-schema.org/draft/2020-12/schema",
  "$id": "https://github.com/binhvugia1997-ui/app-ch-p-nh/specs/schemas/message-catalog.schema.json",
  "title": "MessageCatalog",
  "description": "The localization contract of the guidance layer. `actions` maps every GuidanceInstruction id to its actor and its allowed message keys; `messages` holds the vi (primary) and en (future) text for every key, both instruction keys (`guidance.*`) and display-only labels (`label.*`). Engines emit ids and keys only — never text (AGENTS.md, architecture.md ADR-009). Cross-file validation lives in specs/validation/validate_specs.py.",
  "type": "object",
  "required": [
    "version",
    "status",
    "actions",
    "messages",
    "explanations"
  ],
  "additionalProperties": false,
  "properties": {
    "$schema": {
      "type": "string"
    },
    "version": {
      "type": "string",
      "pattern": "^[0-9]+\\.[0-9]+\\.[0-9]+$"
    },
    "status": {
      "enum": [
        "PHASE_0_DRAFT",
        "DRAFT",
        "RELEASED"
      ]
    },
    "notes": {
      "type": "array",
      "items": {
        "type": "string"
      }
    },
    "actions": {
      "type": "object",
      "description": "Key = GuidanceInstruction id (guidance-instruction.schema.json). The key set must equal that schema's id enum.",
      "minProperties": 1,
      "additionalProperties": {
        "type": "object",
        "required": [
          "actor",
          "messageKeys"
        ],
        "additionalProperties": false,
        "properties": {
          "actor": {
            "enum": [
              "PHOTOGRAPHER",
              "SUBJECT",
              "BOTH"
            ]
          },
          "messageKeys": {
            "type": "array",
            "minItems": 1,
            "items": {
              "type": "string",
              "pattern": "^guidance\\.[a-z0-9_]+(\\.[a-z0-9_]+)*$"
            },
            "description": "Every message key this action may be rendered as. An action with more than one key is contextual (e.g. left/right or gentle/urgent variants)."
          }
        }
      }
    },
    "messages": {
      "type": "object",
      "description": "Key = message key. Vietnamese is the primary MVP language; English is authored now so that localization survives (owner decision 2026-10-03). Instruction keys use `guidance.<domain>.<action>[.<variant>]`; `label.<group>.<value>` is the display-only namespace (e.g. composition band labels) that is never emitted as an instruction and is exempt from the action-reachability check.",
      "minProperties": 1,
      "additionalProperties": {
        "type": "object",
        "required": [
          "vi",
          "en"
        ],
        "additionalProperties": false,
        "properties": {
          "vi": {
            "type": "string",
            "minLength": 1
          },
          "en": {
            "type": "string",
            "minLength": 1
          },
          "params": {
            "type": "array",
            "items": {
              "type": "string"
            },
            "description": "Names of the numeric params the message interpolates (must match GuidanceInstruction.params keys supplied by the engine)."
          }
        }
      }
    },
    "explanations": {
      "type": "object",
      "description": "Key = rule id (specs/rules/mvp-rules.json); value = the message key of the explanation shown when the user asks why an instruction appeared. The validator requires one entry per rule and that every value exists in `messages`.",
      "minProperties": 1,
      "additionalProperties": {
        "type": "string",
        "pattern": "^guidance\\.[a-z0-9_]+(\\.[a-z0-9_]+)*$"
      }
    }
  }
}
