{
  "$schema": "../schemas/message-catalog.schema.json",
  "version": "0.1.0",
  "status": "PHASE_0_DRAFT",
  "notes": [
    "Normative for: instruction id -> actor, instruction id -> allowed message keys, and the message text itself.",
    "Vietnamese is the primary MVP language; English is authored in parallel so the layer is localizable. Neither string may be embedded in analysis/domain code (AGENTS.md).",
    "A rule may only suggest actions listed here for it; specs/validation/validate_specs.py enforces the whole chain rule -> action -> message key -> text.",
    "Wording policy: describe the physical fix, never judge the person; no 'error', 'wrong', 'bad'. Lighting wording must stay relative (lighting-engine.md).",
    "Key convention: `guidance.<domain>.<action>[.<variant>]` — the variant (side, direction) is the final segment, never a suffix on the action name.",
    "Second namespace: `label.<group>.<value>` holds display-only labels (e.g. the composition band of composition-engine.md §2.2) that are never emitted as a GuidanceInstruction. `label.*` keys must not be referenced by `actions` or `explanations`, and are exempt from the action-reachability check because no instruction can trigger them.",
    "`explanations` maps every rule id to the message key shown in the 'why?' sheet; it is not an instruction and never appears in the primary banner (guidance-engine.md §1)."
  ],
  "actions": {
    "MOVE_CAMERA_LEFT": {
      "actor": "PHOTOGRAPHER",
      "messageKeys": [
        "guidance.frame.move_camera_left"
      ]
    },
    "MOVE_CAMERA_RIGHT": {
      "actor": "PHOTOGRAPHER",
      "messageKeys": [
        "guidance.frame.move_camera_right"
      ]
    },
    "MOVE_CAMERA_UP": {
      "actor": "PHOTOGRAPHER",
      "messageKeys": [
        "guidance.frame.move_camera_up"
      ]
    },
    "MOVE_CAMERA_DOWN": {
      "actor": "PHOTOGRAPHER",
      "messageKeys": [
        "guidance.frame.move_camera_down"
      ]
    },
    "MOVE_CLOSER": {
      "actor": "PHOTOGRAPHER",
      "messageKeys": [
        "guidance.frame.move_closer"
      ]
    },
    "MOVE_FARTHER": {
      "actor": "PHOTOGRAPHER",
      "messageKeys": [
        "guidance.frame.move_farther"
      ]
    },
    "ZOOM_IN": {
      "actor": "PHOTOGRAPHER",
      "messageKeys": [
        "guidance.frame.zoom_in"
      ]
    },
    "ZOOM_OUT": {
      "actor": "PHOTOGRAPHER",
      "messageKeys": [
        "guidance.frame.zoom_out"
      ]
    },
    "ROTATE_CAMERA_CW": {
      "actor": "PHOTOGRAPHER",
      "messageKeys": [
        "guidance.frame.rotate_camera_cw"
      ]
    },
    "ROTATE_CAMERA_CCW": {
      "actor": "PHOTOGRAPHER",
      "messageKeys": [
        "guidance.frame.rotate_camera_ccw"
      ]
    },
    "LEVEL_CAMERA": {
      "actor": "PHOTOGRAPHER",
      "messageKeys": [
        "guidance.frame.level_camera"
      ]
    },
    "REFRAME": {
      "actor": "PHOTOGRAPHER",
      "messageKeys": [
        "guidance.frame.reframe",
        "guidance.frame.reframe_joint",
        "guidance.frame.bright_background"
      ]
    },
    "INCREASE_HEADROOM": {
      "actor": "PHOTOGRAPHER",
      "messageKeys": [
        "guidance.frame.increase_headroom"
      ]
    },
    "DECREASE_HEADROOM": {
      "actor": "PHOTOGRAPHER",
      "messageKeys": [
        "guidance.frame.reduce_headroom"
      ]
    },
    "ADJUST_EYE_LINE": {
      "actor": "PHOTOGRAPHER",
      "messageKeys": [
        "guidance.frame.adjust_eye_line"
      ]
    },
    "SUBJECT_MOVE_LEFT": {
      "actor": "SUBJECT",
      "messageKeys": [
        "guidance.pose.step.left"
      ]
    },
    "SUBJECT_MOVE_RIGHT": {
      "actor": "SUBJECT",
      "messageKeys": [
        "guidance.pose.step.right"
      ]
    },
    "SUBJECT_MOVE_INWARD": {
      "actor": "SUBJECT",
      "messageKeys": [
        "guidance.pose.step_inward"
      ]
    },
    "SUBJECT_STEP_BACK": {
      "actor": "SUBJECT",
      "messageKeys": [
        "guidance.pose.step_back"
      ]
    },
    "SUBJECT_STEP_FORWARD": {
      "actor": "SUBJECT",
      "messageKeys": [
        "guidance.pose.step_forward"
      ]
    },
    "SUBJECT_STAND_TALLER": {
      "actor": "SUBJECT",
      "messageKeys": [
        "guidance.pose.stand_taller"
      ]
    },
    "SUBJECT_TURN_LEFT": {
      "actor": "SUBJECT",
      "messageKeys": [
        "guidance.pose.turn_body.left"
      ]
    },
    "SUBJECT_TURN_RIGHT": {
      "actor": "SUBJECT",
      "messageKeys": [
        "guidance.pose.turn_body.right"
      ]
    },
    "SUBJECT_SHIFT_WEIGHT_LEFT": {
      "actor": "SUBJECT",
      "messageKeys": [
        "guidance.pose.shift_weight.left"
      ]
    },
    "SUBJECT_SHIFT_WEIGHT_RIGHT": {
      "actor": "SUBJECT",
      "messageKeys": [
        "guidance.pose.shift_weight.right"
      ]
    },
    "SUBJECT_WIDEN_STANCE": {
      "actor": "SUBJECT",
      "messageKeys": [
        "guidance.pose.widen_stance"
      ]
    },
    "SUBJECT_NARROW_STANCE": {
      "actor": "SUBJECT",
      "messageKeys": [
        "guidance.pose.narrow_stance"
      ]
    },
    "RAISE_LEFT_ARM": {
      "actor": "SUBJECT",
      "messageKeys": [
        "guidance.pose.raise_arm.left"
      ]
    },
    "RAISE_RIGHT_ARM": {
      "actor": "SUBJECT",
      "messageKeys": [
        "guidance.pose.raise_arm.right"
      ]
    },
    "LOWER_LEFT_ARM": {
      "actor": "SUBJECT",
      "messageKeys": [
        "guidance.pose.lower_arm.left"
      ]
    },
    "LOWER_RIGHT_ARM": {
      "actor": "SUBJECT",
      "messageKeys": [
        "guidance.pose.lower_arm.right"
      ]
    },
    "MOVE_ARM_AWAY_FROM_TORSO": {
      "actor": "SUBJECT",
      "messageKeys": [
        "guidance.pose.arm_far_from_torso.left",
        "guidance.pose.arm_far_from_torso.right"
      ]
    },
    "HAND_ON_HIP": {
      "actor": "SUBJECT",
      "messageKeys": [
        "guidance.pose.hand_on_hip.left",
        "guidance.pose.hand_on_hip.right"
      ]
    },
    "HAND_IN_POCKET": {
      "actor": "SUBJECT",
      "messageKeys": [
        "guidance.pose.hand_in_pocket.left",
        "guidance.pose.hand_in_pocket.right"
      ]
    },
    "HAND_AWAY_FROM_FACE": {
      "actor": "SUBJECT",
      "messageKeys": [
        "guidance.pose.hand_away_from_face"
      ]
    },
    "TURN_HEAD_LEFT": {
      "actor": "SUBJECT",
      "messageKeys": [
        "guidance.pose.turn_head.left"
      ]
    },
    "TURN_HEAD_RIGHT": {
      "actor": "SUBJECT",
      "messageKeys": [
        "guidance.pose.turn_head.right"
      ]
    },
    "TILT_HEAD_LEFT": {
      "actor": "SUBJECT",
      "messageKeys": [
        "guidance.pose.tilt_head.left"
      ]
    },
    "TILT_HEAD_RIGHT": {
      "actor": "SUBJECT",
      "messageKeys": [
        "guidance.pose.tilt_head.right"
      ]
    },
    "CHIN_DOWN": {
      "actor": "SUBJECT",
      "messageKeys": [
        "guidance.pose.chin_down"
      ]
    },
    "CHIN_UP": {
      "actor": "SUBJECT",
      "messageKeys": [
        "guidance.pose.chin_up"
      ]
    },
    "LOOK_AT_CAMERA": {
      "actor": "SUBJECT",
      "messageKeys": [
        "guidance.pose.look_at_camera"
      ]
    },
    "LOOK_AWAY": {
      "actor": "SUBJECT",
      "messageKeys": [
        "guidance.pose.look_away"
      ]
    },
    "TURN_ON_LIGHT": {
      "actor": "PHOTOGRAPHER",
      "messageKeys": [
        "guidance.light.turn_on_light"
      ]
    },
    "MOVE_TO_BETTER_LIGHT": {
      "actor": "PHOTOGRAPHER",
      "messageKeys": [
        "guidance.light.move_to_better_light"
      ]
    },
    "MOVE_OUT_OF_BACKLIGHT": {
      "actor": "PHOTOGRAPHER",
      "messageKeys": [
        "guidance.light.move_out_of_backlight",
        "guidance.light.change_camera_position"
      ]
    },
    "TURN_SUBJECT_TOWARD_LIGHT": {
      "actor": "SUBJECT",
      "messageKeys": [
        "guidance.light.turn_subject_to_light"
      ]
    },
    "HOLD_CAMERA_STEADY": {
      "actor": "PHOTOGRAPHER",
      "messageKeys": [
        "guidance.capture.hold_camera_steady"
      ]
    },
    "HOLD_STILL": {
      "actor": "SUBJECT",
      "messageKeys": [
        "guidance.capture.hold_still"
      ]
    },
    "WAIT": {
      "actor": "PHOTOGRAPHER",
      "messageKeys": [
        "guidance.frame.wait_for_subject"
      ]
    },
    "COMPOSITE": {
      "actor": "PHOTOGRAPHER",
      "messageKeys": [
        "guidance.frame.move_closer_lower_camera"
      ]
    }
  },
  "messages": {
    "guidance.frame.move_camera_left": {
      "vi": "Dịch máy ảnh sang trái",
      "en": "Move the camera to the left"
    },
    "guidance.frame.move_camera_right": {
      "vi": "Dịch máy ảnh sang phải",
      "en": "Move the camera to the right"
    },
    "guidance.frame.move_camera_up": {
      "vi": "Nâng máy ảnh lên cao hơn",
      "en": "Raise the camera a little"
    },
    "guidance.frame.move_camera_down": {
      "vi": "Hạ máy ảnh xuống thấp hơn",
      "en": "Lower the camera a little"
    },
    "guidance.frame.move_closer": {
      "vi": "Tiến lại gần hơn một chút",
      "en": "Step closer"
    },
    "guidance.frame.move_farther": {
      "vi": "Lùi ra xa hơn một chút",
      "en": "Step back"
    },
    "guidance.frame.zoom_in": {
      "vi": "Phóng to thêm một chút",
      "en": "Zoom in a little"
    },
    "guidance.frame.zoom_out": {
      "vi": "Thu nhỏ lại một chút",
      "en": "Zoom out a little"
    },
    "guidance.frame.rotate_camera_cw": {
      "vi": "Nghiêng máy ảnh theo chiều kim đồng hồ",
      "en": "Turn the camera clockwise"
    },
    "guidance.frame.rotate_camera_ccw": {
      "vi": "Nghiêng máy ảnh ngược chiều kim đồng hồ",
      "en": "Turn the camera anticlockwise"
    },
    "guidance.frame.level_camera": {
      "vi": "Giữ máy ảnh thẳng",
      "en": "Level the camera"
    },
    "guidance.frame.reframe": {
      "vi": "Canh lại bố cục",
      "en": "Reframe the shot"
    },
    "guidance.frame.reframe_joint": {
      "vi": "Đừng cắt ngay khớp: cổ tay, đầu gối, cổ chân",